<?xml version="1.0" encoding="UTF-8"?>

<class xmlns="file:///C:/stud"
xmlns:xsi="http://www.w3.org/2001/XMLSchema-instance"
xsi:schemaLocation="file:///C:/stud/stud_xsd.xsd">

	<student>
		<id>1</id>
		<name>Abhinav</name>
		<marks>123</marks>
	</student>
	<student>
		<id>2</id>
		<name>Adi</name>
		<marks>567</marks>
	</student>
	
</class>